{
  "benchmark_id": "fiction-role-benchmark-v1.2-wave1c-holdout",
  "pack_version": "1.2.0-holdout",
  "role": "researcher",
  "attempt_id": "wave1c-luna-researcher-c1",
  "requested_route": {
    "provider": "openai-codex",
    "model": "gpt-5.6-luna",
    "profile": "gpt56-luna",
    "evidence_path": "route-evidence.log"
  },
  "served_route": {
    "provider": "openai-codex",
    "model": "gpt-5.6-luna",
    "profile": "gpt56-luna",
    "evidence_path": "route-evidence.log"
  },
  "routing_status": "verified_exact",
  "profile": "gpt56-luna",
  "tool_policy": "none",
  "actual_tool_turn_count": 0,
  "sampling_settings": {
    "temperature": null,
    "reasoning": "medium",
    "max_output_tokens": 4096
  },
  "packet_manifest_sha256": "085b2d6aade816e8f567e7d137dc928927a5180d19be187b0a225a80d78f3a70",
  "started_at": "2026-08-10T07:47:19.333947+00:00",
  "ended_at": "2026-08-10T07:47:39.615850+00:00",
  "latency_ms": 19474,
  "session_identifier": "20260810_174720_d1ac73",
  "route_evidence_path": "route-evidence.log",
  "status": "pass",
  "failures": [],
  "artifacts": [
    {
      "path": "prompt.txt",
      "sha256": "d9a8f34ada533246c3b447a049f9090612f1b4271ecb3937df3908f81251fbdc"
    },
    {
      "path": "no-tool-policy-proof.json",
      "sha256": "69ba17fb1e9bb742ae8ed5446c2e9a4c06a81bc5ca57fc5ba1a22a2131b3ad79"
    },
    {
      "path": "hermes-wrapper-stdout.raw.txt",
      "sha256": "ba9a7345d5cce58f6b7e1686884c608a4cffb0cc980e2ca08d406ca6349e774c"
    },
    {
      "path": "hermes-wrapper-stderr.raw.txt",
      "sha256": "047bd12e1741fffccc63430e09336f3af186cb28269701411f87d14961ffb51a"
    },
    {
      "path": "provider-response.raw.txt",
      "sha256": "e08a646f904602d4ce669270533dff5f5b00fac344ed052f529adb53f7da2f1f"
    },
    {
      "path": "wrapper-notices.txt",
      "sha256": "619de2490fd385c23f54e620cf4f402df819a66820dbdd6fc708a16d08733e7e"
    },
    {
      "path": "route-evidence.log",
      "sha256": "978836bfb8e16fda51a184188621d2910dd5f2823ad0c83fa0b49f1a2f0d07a0"
    },
    {
      "path": "submission.json",
      "sha256": "e08a646f904602d4ce669270533dff5f5b00fac344ed052f529adb53f7da2f1f"
    },
    {
      "path": "extraction-normalization.json",
      "sha256": "0e93536cdfeaa6d6d83d136cd1279969fa342963ba32817bff99cfaafb4b7857"
    },
    {
      "path": "validation-result.json",
      "sha256": "a61bdce1037642c7cae914b12edc2d83c733a4f79ab4d71cd07a17225d75159b"
    }
  ],
  "usage": {
    "input_tokens": 1782,
    "output_tokens": 840,
    "cached_tokens": null,
    "total_tokens": 2622
  },
  "wrapper_exit_code": 0,
  "api_latency_ms": 17000,
  "score": null
}
